English,Akuapem 
I belong here.,Me na mewɔ ha.
I belong here.,Me fata sɛ mewɔ ha.
I belong here.,Ha na me wɔ.
Kwaku sings quite well.,Kwaku to dwom yiye.
Kwaku sings quite well.,Kwaku nim nwom to.
He calls her up every night.,Anadwo biara ɔfrɛ no. 
He calls her up every night.,Ɔfrɛ no anadwo biara 
I don't have any money at all.,Minni sika koraa.
I don't have any money at all.,Sika biara nni me ho. 
I love your dress.,M'ani gye wo ntadehyɛ ho.
I love your dress.,M'ani gye w'ataadeɛ no ho. 
I love your dress.,W'ataadeɛ no yɛ fɛ. 
This is what I can do for you.,Eyi na metumi ayɛ ama wo.
This is what I can do for you.,Deɛ mɛtumi ayɛ ama wo ara nie. 
This is what I can do for you.,Deɛ mɛtumi ayɛ aboa wo no no. 
She met him this morning.,"Anɔpa yi, ohyiaa no."
She met him this morning.,Ɔhyiaa no anɔpa yi. 
She met him this morning.,Anopa yi ara na ɔne no redi ahyiam. 
I'd rather not go out today.,Merenyɛ saa nnɛ.
I'd rather not go out today.,Mempɛ sɛ mɛpue nnɛ. 
I'd rather not go out today.,Ɛnni me mu sɛ mɛkɔ abɔntene nnɛ. 
What time will you leave?,Bere bɛn na wubefi hɔ?
What time will you leave?,Berɛ bɛn na wobɛkɔ?
What time will you leave?,Wobɛfiri ha berɛ bɛn?
Don't lose your temper.,Mma wo bo mfuw.
Don't lose your temper.,Hyɛ wo ho so. 
Don't lose your temper.,Ka w'akoma to wo yam. 
Don't lose your temper.,Adwoberɛw.
Which is mine?,Nea ɛwɔ he na meyɛ?
Which is mine?,Deɛ ɛwc hen na yɛ me dea?
Which is mine?,Ɛmu nea ɛwɔ hen na ɛwɔ me?
We left at 2:30.,Yefii hɔ 2:30.
We left at 2:30.,Ɛbɔɔ 2:30 na yɛfirii hɔ.
We left at 2:30.,Yɔrefiri hɔ no na 2:30 abɔ.
"She likes animals, you know?","Ɔte sɛ mmoa, wunim?"
"She likes animals, you know?",Wonim sɛ n'ani gye mmoa ho?
"She likes animals, you know?",Wonim sɛ ɔpɛ mmoa asɛm?
You haven't got much time.,Wonni mmre.
You haven't got much time.,Mmerɛ nni hɔ ma wo.
You haven't got much time.,Wo mmerɛ a aka sua.
"Sooner or later, we all are going to die.","Ɛrenkyɛ koraa na yɛn nyinaa bɛwu."
"Sooner or later, we all are going to die.",Ɔbra twa owuo.
"Sooner or later, we all are going to die.",Ɛberɛ bi bɛba a yɛn nyinaa bɛwu.
Kwaku has next to nothing in his wallet.,Kwaku nni biribiara wɔ ne bag mu. 
Kwaku has next to nothing in his wallet.,Kwaku bɔtom awe.
Kwaku has next to nothing in his wallet.,Kwaku nni ne ho hwee.
Kwaku has next to nothing in his wallet.,Kwaku nni sika wɔ ne walɛt mu.
I'm Kwaku's boss.,Meyɛ Kwaku adwumam panyin.
I'm Kwaku's boss.,Kwaku adwuma mu panin ne me. 
I'm Kwaku's boss.,Me na mehwɛ Kwaku so wɔ adwuma mu.
I'm Kwaku's boss.,Meyɛ Kwaku panin wɔ adwuma mu.
It's their job.,Ɛyɛ wɔn adwuma.
It's their job.,Wɔn adwuma no no.
It's their job.,Adwuma a wɔyɛ no no.
That's your problem., Ɛno ne wo haw.
That's your problem.,"Ɛno deɛ, w'asɛm."
Kwaku recognized me., Kwaku huu me.
Kwaku recognized me., Kwaku kaee me.
Kwaku recognized me., Kwaku werɛ amfi me.
Kwaku recognized me., Kwaku hunuu sɛ ɛyɛ me a.
What language do they speak in Switzerland?, Kasa bɛn na wɔka wɔ Switzerland?
What language do they speak in Switzerland?, Wɔka kasa bɛn wɔ Switzerland?
Almost three thousand people died., Nnipa bɛyɛ mpensa wuwui.
Almost three thousand people died., Nnipa a wɔwui no bɛduru mpem mmiɛnsa.
Almost three thousand people died., Nnipa a wɔwui no bɛyɛ mpem mmiɛnsa.
We'll notify Kwaku., Yɛrenni kan nka Kwaku ho asɛm.
We'll notify Kwaku., Yɛbɛyi Kwaku asotire.
We'll notify Kwaku., Yɛbɛbɔ Kwaku amanneɛ.
We'll notify Kwaku., Yɛne Kwaku bɛdi ho nkɔmmɔ.
I don't have time to be sick., Minni bere a mede bɛsa.
I don't have time to be sick., Menni berɛ na mede ayare.
I don't have time to be sick., Mmerɛ nni na mede ayare.
Her son's death broke Abena's heart., Ne babarima no wu no maa Abena koma tui.
Her son's death broke Abena's heart., Abena babarima wuo no aha no yie.
Her son's death broke Abena's heart., Abena adi ne babarima wuo no ho yaw pa ara.
That isn't Kwaku's bicycle., Ɛno nyɛ Kwaku sakre.
That isn't Kwaku's bicycle., Sakre wei nni Kwaku.
That isn't Kwaku's bicycle., Sakre wei nyɛ Kwaku dea.
That isn't Kwaku's bicycle., Ɛnyɛ Kwaku sakre no nie.
No one showed up., Obiara amma.
No one showed up., Obiara ansi hɔ.
She made friends with Asamoah at the party., Onyaa nnamfo wɔ apontow no ase.
She made friends with Asamoah at the party., Apontoɔ no ase na ɔne Asamoah faa nnamfoɔ.
She made friends with Asamoah at the party., Apontoɔ no ase na ɔne Asamoah nyaa ayɔnkofa.
Cain was evil., Ná Kain yɛ ɔbɔnefo.
Cain was evil., Na Cain tirimu yɛ sum.
Cain was evil., Na Cain yɛ nipabɔne ni.
I've been sick for a very long time., Mayare bere tenten.
I've been sick for a very long time., Mayare akyɛ.
I've been sick for a very long time., Mmerɛ tenten nie na mayare.
I've been sick for a very long time., Yareɛ yi atena me so akyɛ.
Who told you the story?, Hena na ɔkaa asɛm no kyerɛɛ wo?
Who told you the story?, Hwan na bɔɔ wo amaneɛ?
Who told you the story?, Hwan na bɔɔ wo asɛm no mu?
We'll lose everything., Yɛbɛsɛe biribiara.
We'll lose everything., Yɛbɛhwere biribiara.
We'll lose everything., Biribiara bɛhwere yɛn.
We'll lose everything., Ne nyinaa bɛfiri yɛn nsa.
Shall I go on?, So mɛkɔ so ayɛ?
Shall I go on?, Metumi toa so anaa?
Shall I go on?, Mentoa so anaa?
Kwame isn't happy about what's happened., "Nea esii no, nea asi no, n'ani nnye ho."
Kwame isn't happy about what's happened., Kwame ani annye nea ɛsiiɛ no ho.
I thought it was Kwame., Na ɛyɛ me sɛ me na me ne no nam.
I thought it was Kwame., Na ɛyɛ me sɛ ɛyɛ Kwame a.
I thought it was Kwame., Na medwene sɛ Kwame a.
What kind of dreams do you have?, Anidaso bɛn na wowɔ?
What kind of dreams do you have?, Wo daeɛso ne sɛn?
What kind of dreams do you have?, Wo tirimpɔ ne sɛn?
What kind of dreams do you have?, Wo botaeɛ ne sɛn?
He came all the way from Nikko to see me off., Ɔbaa hɔ bɛhwɛɛ me.
He came all the way from Nikko to see me off., Ɔbɔɔ anamɔn firii Nikko bɛgyaa me kwan.
He came all the way from Nikko to see me off., Ɔfirii Nikko bɛgyaa me kwan.
Don't be sad., Mma w'abam mmu.
Don't be sad., Mma wo werɛ nho.
Don't be sad., Nni awerɛhoɔ.
He can't control his desires., Ontumi nni n'akɔnnɔ ahorow so.
He can't control his desires., Ɔntumi nhyɛ n'akɔnnɔ so.
I didn't say anything., Mantumi anka hwee.
I didn't say anything., Manka hwee.
I didn't say anything., Manka biribiara.
Asamoah isn't my father., Me papa a wɔfrɛ no ulah no nyɛ me papa.
Asamoah isn't my father., Asamoah nyɛ me papa.
Asamoah isn't my father., Ɛnyɛ me papa ne Asamoah.
Asamoah isn't my father., Me papa nyɛ Asamoah.
He likes singing., N'ani gye nnwonto ho.
He likes singing., Ɔpɛ nnwontoɔ.
He likes singing., Adeɛ a ɔpɛ ne nnwontoɔ.
Who's your favorite teacher?, Hena ne kyerɛkyerɛni a w'ani gye ne ho paa?
Who's your favorite teacher?, Kyerɛkyerɛni bɛn na wopɛ n'asɛm?
Who's your favorite teacher?, Hwan ne ɔkyerkyerɛni a wopɛ n'asɛm?
"Be respectful to your superiors, if you have any.", "Sɛ wowɔ bi a, bu wo mpanyimfo."
"Be respectful to your superiors, if you have any.", "Sɛ wowɔ akannifoɔ a, fa anidie ma wɔn."
"Be respectful to your superiors, if you have any.", "Sɛ wowɔ mpanimfoɔ a, bu wɔn."
How many friends do you have on Facebook?, Nnamfo dodow ahe na wowɔ wɔ Fcaebook so?
How many friends do you have on Facebook?, Wo nnamfonom a ɛwɔ Facebook yɛ sɛn?
How many friends do you have on Facebook?, Wo Facebook nnamfonom yɛ dodoɔ sɛn?
Children mostly lack patience., "Mmere pii, mmofra nni ntoboase."
Children mostly lack patience., Abotare yɛ adeɛ a mpɛn pii no ara mmɔfra nni.
Children mostly lack patience., Adeɛ a mmɔfra nni ne abotare.
I can't keep lying to Osei., Mentumi nkɔso nni atoro nkyerɛ Osei.
I can't keep lying to Osei., Mentumi ntoa so ntwa Osei ntorɔ.
I can't keep lying to Osei., Mentumi nni Osei atorɔ bio.
That is not what I want., Ɛnyɛ eyi na mepɛ.
That is not what I want., Ɛnyɛ nea mepɛ nie.
That is not what I want., Ɛnyɛ nea merehwehwɛ nie.
That is not what I want., Wei nyɛ nea mepɛ.
That is not what I want., Nea mepɛ no nyɛ wei.
I just want to thank you for all of your help., Mepɛ sɛ meda mo ase wɔ mo mmoa nyinaa ho.
I just want to thank you for all of your help., Mepɛ sɛ meda wo ase wɔ nea woayɛ ama me nyinaa.
I just want to thank you for all of your help., Mepɛ sɛ meda wo ase wɔ w'adɔeɛ nyinaa ho.
Can I go in there now?, So metumi akɔ hɔ seesei?
Can I go in there now?, Afei mɛtumi akɔ mu?
Can I go in there now?, Afei mɛtumi awura mu?
Can I go in there now?, Mɛtumi awura mu seesei?
Kwabena gave thanks to God., Kwabena daa Onyankopɔn ase.
Kwabena gave thanks to God., Kwabena de aseda maa Onyankopɔn.
Kwabena gave thanks to God., Kwabena de Onyankopɔn aseda maa no.
He devoted his life to his study., Ɔde ne bere nyinaa suaa ade.
He devoted his life to his study., Watu ne ho asi hɔ ama n'adesua.
He devoted his life to his study., Wagyae birbiara mu ama n'adesua.
Kwabena is very intelligent., Kwabena nim ade paa.
Kwabena is very intelligent., Kwabena nim nwoma pa ara.
Kwabena is very intelligent., Kwabena adwene mu dɔ yie.
Kwabena is very intelligent., Kwabena yɛ onimdefoɔ.
That bridge is made of stone., Wɔde abo na ɛyɛɛ saa twene no.
That bridge is made of stone., Aboɔ na wɔde yɛɛ saa twene no.
That bridge is made of stone., Saa twene no yɛ aboɔ twene.
I can't believe you’re doing this to me., Woayɛ m'ade ama me ho adwiriw me.
I can't believe you’re doing this to me., Ɛyɛ me nwanwa sɛ woatumi ayɛ me sei.
I can't believe you’re doing this to me., Mannwene ho da sɛ wobɛtumi ayɛ me sei.
I can't believe you’re doing this to me., Enti me na woayɛ me sei yi.
Kwabena was shocked by what Abena said., Nea Abena kae no maa Kwabena ho dwiriw no.
Kwabena was shocked by what Abena said., Abena nsɛm a ɔkaeɛ no maa Kwabena ho dwirii no. 
Kwabena was shocked by what Abena said., Kwabena ho dwirii no wɔ nsɛm a Abena kaeɛ no.
He lived in Ankara for six years., Ɔde mfe asia traa Ankara.
He lived in Ankara for six years., Ɔtenaa Ankara mfeɛ nsia.
He lived in Ankara for six years., Mfeɛ nsia mu na ɔtenaa Ankara. 
He lived in Ankara for six years., Ankara ha na ɔtenaa mfeɛ nsia.
She is a pleasant person., N'anim tew.
She is a pleasant person., Ɔyɛ obi a ɔpɛ nipa.
She is a pleasant person., Ɔdɔ nipa.
She is a pleasant person., Ɔka ne ho bɛn nipa.
I was about to go., Na merebɛkɔ.
I was about to go., Anka merebɛkɔ ara no no.
I can't get her out of my mind., Mintumi nnyi m'adwene mfi ne so.
I can't get her out of my mind., Mentumi nyi no mfiri m'adwene mu. 
I can't get her out of my mind., Mentumi nyi ne ho adwendwene mfiri me mu. 
I can't get her out of my mind., Ne ho adwene wɔ me tirim.
The road's in bad condition., Kwan no nnye.
The road's in bad condition., Kwan no asɛe.
The road's in bad condition., Kwan no nyɛ papa.
She works at the bank.,	Ɔyɛ adwuma wɔ sikakorabea.
She works at the bank.,	N'adwumabea ne sikakorabea hɔ.
She works at the bank.,	Sikakorabea hɔ na ɔyɛ adwuma.
She works at the bank.,	Ɔyɛ n'adwuma wɔ sikakorabea hɔ.
What happened last month?, Dɛn na esii ɔsram a etwaam no mu?
What happened last month?, Bosome a ɛtwaa mu no ɛdeɛn na siiɛ?
What happened last month?, Nsɛm bɛn na sii bosome a ɛtwaa mu no?
I do the laundry on Sundays., Mehoro nneɛma Kwasida biara.
I do the laundry on Sundays., Mesi nneɛma Kwasiada biara.
I do the laundry on Sundays., Kwasiada biara na mesi nneɛma.
I do the laundry on Sundays., Nneɛma mesi no yɛ Kwasiada biara.
Kwabena is already in Boston., Kwabena wɔ Boston dedaw.
Kwabena is already in Boston., Kwabena adi kan wɔ Boston. 
Kwabena is already in Boston., Kwabena aduru Boston dada.
Whose pencil is this?, Hena pɛnsere ni?
Whose pencil is this?, Pɛnsere yi wɔ hwan?
Whose pencil is this?, Hwan na pɛnsere no yɛ ne dea?
Don't be stupid., Nnyimi.
Don't be stupid., Nni nkwaseasɛm.
Don't be stupid., Ma w'ani nna hɔ.
Don't be stupid., Nni agyimisɛm biara.
She is interested in jazz., N'ani gye jazz ho.
She is interested in jazz., N'ani di jazz akyi. 
She is interested in jazz., Ɔpɛ jazz.
She is interested in jazz., Jazz yɛ adeɛ a n'ani gye ho.